{
  "schema_version": 1,
  "project_id": "P-3",
  "revision": 9,
  "goal": "Xây kênh YouTube dạy tiếng Nhật qua hoạt động hằng ngày, tương tự kênh 누구나영어 \"English for Everyday Activities\": mỗi video một hoạt động (thức dậy, đánh răng, đi tàu...), tranh minh hoạ nhất quán, câu tiếng Nhật ngắn đọc chậm từng bước kèm nghĩa. Giai đoạn hiện tại: lập plan và pilot để người dùng duyệt; chưa sản xuất hàng loạt, chưa tạo kênh hoặc đăng, chưa tăng chi.",
  "stage": "planning",
  "constraints": [
    "Prefer existing tools; no additional paid services without user authorization",
    "No channel creation or publishing in v0"
  ],
  "current_task": {
    "id": "T-001",
    "owner_role": "pm",
    "execution": "waiting_user"
  },
  "plan": {
    "path": "plans/plan-v8-r9-2847e385.md",
    "sha256": "2eb540700760f084276d02a3b4da05f305411b19e31cf939e3fb39ed70bfe13d",
    "revision": 8
  },
  "approval": {
    "status": "pending",
    "record": null
  },
  "decision_records": [],
  "artifacts": [],
  "reviews": [],
  "acceptance": "not_reviewed",
  "release": "not_requested",
  "next_action": "Present the exact plan revision for user approval",
  "unresolved": [],
  "usage": {
    "input_tokens": 0,
    "output_tokens": 0,
    "cached_input_tokens": 0,
    "samples": {},
    "baselines": {},
    "available": false
  },
  "created_at": "2026-10-21T05:27:13.472160+00:00",
  "updated_at": "2026-10-21T09:36:53.058700+00:00"
}
